Article Title,Article Link,Article Text,Article Summary,Article Image
"Cash row inquiry report: 'No cash was ever placed in that storeroom', claims Justice Yashwant Varma",https://timesofindia.indiatimes.com/india/cash-row-inquiry-report-no-cash-was-ever-placed-in-that-storeroom-claims-delhi-high-court-justice-yashwant-varma/articleshow/119363968.cms,"Delhi HC judge Yashwant Varma

NEW DELHI: Delhi high court judge Yashwant Varma has strongly denied allegations that a large sum of burnt currency was recovered from his official residence after a recent fire incident.In a lengthy letter to Delhi high court's chief justice, Devendra Kumar Upadhyaya, Justice Varma called the claims ""baseless"" and ""preposterous"", asserting that neither he nor his family had any connection to the alleged cash.""I state unequivocally that no cash was ever placed in that storeroom either by me or any of my family members and strongly denounce the suggestion that the alleged cash belonged to us,"" he wrote. ""The very idea or suggestion that this cash was kept or stored by us is totally preposterous.""Questioning the credibility of the allegations, he added, ""The suggestion that one would store cash in an open, freely accessible and commonly used storeroom near the staff quarters or in an outhouse verges on the incredible and incredulous.""Justice Varma said the accusations had severely damaged his reputation. ""In the life of a judge, nothing matters more than reputation and character. That has been severely tarnished and irreparably damaged,"" he stated.He dismissed any suggestion that he removed or handled currency at the site, saying, ""I categorically reject any suggestion that we removed currency from the storeroom. We were neither shown nor given any sacks of burnt currency. The limited debris recovered during the incident was confined to a particular section of the residence, and there was no evidence of any currency.""Drawing attention to his financial transparency, he mentioned that all his transactions were conducted through banks, UPI, and cards. He also pointed out that authorities found no cash when the site was returned to him, stating, ""When the site was handed back to us after the fire personnel and police concluded their operations, we saw no evidence of any currency.""Following the controversy, CJI Sanjiv Khanna has constituted a three-member inquiry committee to investigate the allegations.The panel includes Justice Sheel Nagu, Chief Justice of the Punjab and Haryana high court, Justice G S Sandhawalia, Chief Justice of the Himachal Pradesh high court, and Justice Anu Sivaraman of the Karnataka high court.CJI Khanna also directed that Justice Varma be relieved of judicial duties until the inquiry is completed.","Delhi high court judge Yashwant Varma has strongly denied allegations that a large sum of burnt currency was recovered from his official residence after a recent fire incident. In a lengthy letter to Delhi high court's chief justice, Devendra Kumar Upadhyaya, Justice Varma called the claims ""baseless"" and ""preposterous""","https://static.toiimg.com/thumb/msid-119364660,imgsize-19500,width-400,resizemode-4/119364660.jpg"
‘No evidence of forced entry’: Key details from Delhi HC CJ’s report on Justice Varma cash row,https://timesofindia.indiatimes.com/india/justice-yashwant-varma-no-evidence-of-forced-entry-delhi-hc-chief-justices-findings-on-judge-cash-row/articleshow/119362776.cms,"Key findings from the inquiry report



The fire broke out on the night of March 14 in a storeroom at Justice Varma’s official residence in Tughlak Crescent, New Delhi.

The fire was initially reported by Justice Varma’s personal secretary via a PCR call.

Firefighters allegedly found burnt cash at the scene, raising concerns about its origin.

No evidence of forced entry into the storeroom was found.

The storeroom was used to store household items and was accessible to domestic staff, gardeners, and CPWD workers.

Some debris and half-burnt items were removed from the storeroom on the morning of March 15.

Given the seriousness of the allegations, Delhi high court Chief Justice Upadhyay has recommended a deeper probe.

The Supreme Court has directed Justice Varma to preserve all data and messages on his phone and has sought security records from the past six months.

Justice Varma has been relieved of judicial duties pending the inquiry's outcome.

Justice Varma denies allegations, calls it a conspiracy



SC sets up three-member inquiry panel



Supreme Court press release full document:



The Supreme Court on Saturday released an inquiry report by Delhi high court chief justice Devendra Kumar Upadhyay regarding Justice Yashwant Varma's case, which involved the discovery of burnt currency notes by firefighters at his official residence.A video shared by Delhi Police Commissioner Sanjay Arora with Chief Justice of India Sanjiv Khanna and Delhi high court chief justice Upadhyay purportedly shows the burnt cash, adding to the scrutiny.According to the report, on March 15, workers cleared some debris and partially burnt items from the storeroom. Subsequently, the Supreme Court instructed Justice Varma to maintain all phone data and communications. Additionally, the court requested records of security staff deployed at his residence over the previous six months. Justice Varma has been temporarily removed from his judicial responsibilities whilst the investigation continues.Also read: SC uploads video of burnt currency given by police, HC CJ suggests deeper probe; judge Yashwant Varma cries conspiracy Justice Varma has strongly denied any wrongdoing, calling the allegations an attempt to malign him. In his response to the inquiry panel, he stated that neither he nor his family had any connection to the cash allegedly found at the site.“My wife and I were not in Delhi at the time of the fire. The storeroom is a common area used by staff and is not part of my main residence. The claim that we kept cash there is absurd,” he said.Also read: Cash row inquiry report: 'No cash was ever placed in that storeroom', claims Justice Yashwant Varma Justice Varma also questioned the evidence, stating that when he inspected the storeroom after the fire, no cash was present. “Later, a video was shown to me suggesting otherwise. This raises serious concerns about evidence tampering,” he added.He further pointed to previous online allegations against him in December 2024, hinting at a possible effort to damage his reputation.The Supreme Court has set up a three-member inquiry panel to investigate the case. The committee includes Punjab & Haryana high court, chief justice Sheel Nagu, Himachal Pradesh high court chief justice G S Sandhawalia, and Karnataka high court judge Anu Sivaraman.With the inquiry now underway, the Supreme Court will review Justice Varma’s response along with forensic findings related to the alleged cash recovery. The panel will determine whether there is any direct link between the cash and the judge or his family.The court’s directive to preserve Justice Varma’s mobile data suggests that phone records and messages could play a role in the investigation. The case has sparked debate in legal and political circles, with concerns about both judicial integrity and possible attempts to frame the judge.The committee is expected to submit its findings to the Supreme Court in the coming weeks.","Fire broke out in a storeroom at Justice Yashwant Varma's official residence in New Delhi. Firefighters allegedly found burnt cash at the scene, raising concerns about its origin. Justice Varma has strongly denied any wrongdoing, calling the allegations an attempt to malign him.","https://static.toiimg.com/thumb/msid-119365249,imgsize-4286684,width-400,resizemode-4/119365249.jpg"
Fugitive businessman Mehul Choksi living in Belgium: Report,https://timesofindia.indiatimes.com/india/fugitive-businessman-mehul-choksi-living-in-belgium-report/articleshow/119362229.cms,"<p>Mehul Choksi<br></p>

NEW DELHI: Fugitive businessman Mehul Choksi is reportedly living in Belgium's Antwerp with his wife, Preeti Choksi, after securing an ‘F Residency Card’ in the country, according to a media report.Indian authorities have reportedly urged Belgium to initiate his extradition to India after knowing his whereabouts, the Associated Times reported.Choksi, accused of defrauding Punjab National Bank of over Rs 13,000 crore, obtained residency in Belgium and secured an 'F Residency Card' on November 15, 2023, reportedly facilitated by his wife, a citizen of Belgium. According to the Carribean-focused media outlet, Choksi had fabricated his documents to Belgian authorities and misrepresented his nationality in his application process, failing to disclose the details of his existing citizenship.It is believed that Choksi was believed to be living in Antigua and Barbuda before travelling to Belgium and is planning to move to Switzerland.The matter came days after Antigua and Barbuda’s Foreign Minister EP Chet Greene said that Choksi is no longer on the island.Greene, who was invited to participate in the Raisina Dialogue, did not reveal where Choksi had gone and noted, “Mehul Choksi is not on the island. I am told he left Antigua for medical attention abroad (but) he remains a citizen of Antigua and Barbuda. The governments, yours (India) and mine, are working together on this matter.”Choksi departed from India in January 2018 after being implicated in the PNB case. His nephew, Nirav Modi, was also implicated and currently awaits extradition proceedings in London.In May 2023, Choksi informed a Mumbai special court that circumstances beyond his control prevented his return to India, contesting the label of 'fugitive economic offender'. He claims he did not leave to avoid prosecution and is not refusing to return, adding that Indian authorities suspended his passport.The ED approached the special court seeking to designate him as a 'fugitive economic offender' for avoiding their summons and to enable confiscation of his assets under applicable legislation.In May 2021, his disappearance from Antigua led to speculation about abduction by Indian authorities - claims disproven when he was located in Dominica. Some suggested he attempted to avoid potential extradition.Dominican authorities arrested him for unlawful entry, but he returned to Antigua on medical grounds with interim bail. The proceedings were halted in May 2022.Choksi disputed the illegal entry allegations, stating that individuals posing as police officers took him from his restaurant, Jolly Roger in Antigua, to Dominica by boat.In December 2023, Finance Minister Nirmala Sitharaman informed Parliament that assets valued at Rs 22,280 crore had been recovered or liquidated to settle debts of wanted persons including Choksi.","Indian authorities have reportedly urged Belgium to initiate his extradition to India. Choksi is accused of defrauding Punjab National Bank of over Rs 13,000 crore. He departed from India in January 2018 after being implicated in the PNB case. His nephew, Nirav Modi, was also implicated and currently awaits extradition.","https://static.toiimg.com/thumb/msid-119362696,imgsize-26178,width-400,resizemode-4/119362696.jpg"
'You rose to power promising a secular rule': Muslim body declines Bihar CM Nitish Kumar’s Iftaar invitation,https://timesofindia.indiatimes.com/india/you-rose-to-power-promising-a-secular-rule-muslim-body-declines-bihar-cm-nitish-kumars-iftaar-invitation/articleshow/119361879.cms,"PTI photo

A major Muslim organisation in Bihar, the Imarat Shariah, has declined Chief Minister Nitish Kumar’s invitation for an Iftaar gathering on Sunday.The group, which has a strong following in Bihar, Jharkhand, and Odisha, cited Kumar’s support for the Waqf Bill as the reason. They claim the bill will worsen the economic and educational conditions of Muslims.In a letter responding to the invitation, the Imarat Shariah said, “A decision has been taken not to attend the government Iftaar on March 23. This decision is in protest against your support for the Waqf Bill, which threatens to increase the backwardness of Muslims,” quoted PTI.The organisation accused Kumar of breaking his promise to protect minority rights. ""You rose to power promising a secular rule in which minorities' rights were protected. But your alliance with the BJP and your support for legislation that is unconstitutional and illogical militate against your stated commitments,"" the Imarat Shariah alleged.The Imarat Shariah further criticised the Iftaar event, calling it “tokenism.” It claimed that the government’s indifference to Muslim concerns made such events meaningless.The JD(U) has traditionally counted on Muslim votes by presenting Kumar as a secular leader. The state elections are scheduled for later this year.The Janata Dal (United), has not responded to the boycott yet.The Jamiat Ulema-e-Hind had announced on Friday that it will no longer engage with such individuals as a ""symbolic protest."" The organisation also said that it will not take part in their events, including Iftaar and Eid Milan.The Waqf (Amendment) Bill is set to be presented in the Lok Sabha next week. The proposed changes aim to update the Waqf system. Key provisions include tighter regulations on the registration and oversight of Waqf properties.One of the most controversial aspects of the bill is the change in ownership rules, which would affect historical mosques, dargahs, and graveyards managed by the board.","The Imarat Shariah, a major Muslim organisation in Bihar, has declined Chief Minister Nitish Kumar’s invitation for an Iftaar gathering on Sunday. They claim the bill will worsen the economic and educational conditions of Muslims. The Jamiat Ulema-e-Hind had announced on Friday that it will no longer engage with such individuals.","https://static.toiimg.com/thumb/msid-119362030,imgsize-29144,width-400,resizemode-4/119362030.jpg"
Can Heathrow nightmare hit Indian airports?,https://timesofindia.indiatimes.com/india/can-heathrow-nightmare-hit-indian-airports/articleshow/119361222.cms,"A question of backup

Where Indian airports stand

Pressure to make green break

How to avoid hiccups

The power outage that crippled London-Heathrow on Friday was not an isolated incident for the global airline industry, except for the scale of flight disruptions, which was unprecedented. Ask aviation experts and they’ll tell you that it’s more than just an operational mishap but a warning for the entire airline industry.International Air Transport Association (IATA) director general Willie Walsh voiced the questions now on everyone’s mind. “First, how is it that critical infrastructure, of national and global importance, is totally dependent on a single power source without an alternative? If that is the case, as it seems, then it is a clear planning failure by the airport.”Heathrow is the UK’s largest hub, handling over 1,300 flights a day. For comparison, Mumbai airport handles about 950 flights a day. Heathrow had to shut down after a fire at the North Hyde substation, located about 1.5 miles north of the airport, caused a “significant power outage”. A Heathrow spokesperson said “backup systems have been working as they should but they are not sized to run the entire airport”.Can such an incident occur at any airport in the world or was it merely a result of Heathrow’s legacy infrastructure? Experts said a substation fire may not be a risk unique to Heathrow, but it exposes the pitfalls of relying on a single external power source without sufficient backup systems or onsite supply in the form of solar, wind, or diesel generators, etc. Aviation norms ensure critical units like air traffic control towers, runway lighting, etc, are typically fed by uninterruptible power supply (UPS). The problem is with nonessential operations, the kind that involves operations at passenger terminals.Mumbai airport, India’s second largest airport with its two passenger terminals and one cargo terminal, consumes 26.9 MW power a day. “We receive power through two independent, redundant (back up) sources. In the event of a failure at one source, the other can seamlessly take over 100% of the power load to ensure operational continuity. Each terminal gets electricity from more than one power station,” said a Mumbai International Airport Ltd (MIAL) spokesperson.There are multiple pathways to deliver power to each terminal. “The system is designed to handle not just one failure, but two back-to-back failures without stopping operations. Both the terminals and the airfield have their own diesel generators, with a total capacity of 30 MW. These get activated in the case of a rare, major failure,” the official said. Mumbai airport runs on 100% renewable energy, 5% comes from on-site solar generation and 95% from hydro and wind energy. Bangalore International Airport Ltd (BIAL) said it uses a highly resilient and redundant power infrastructure for uninterrupted operations. “BLR airport receives power from Begur substation, which gets power through four independent supply lines from different substations,” said Hari Marar , MD and CEO, BIAL. “BIAL has also installed a separate transformer at the Begur substation dedicated for airport operations, minimising the risk of disruptions and also integrated on-site solar power generation and gone for tieups with off-site external renewable energy suppliers, ensuring a steady supply of green power,” he added.Unlike the 16-year old Bengaluru airport, many major airports rely on infrastructure designed long before modern digital systems and sustainability requirements became key concerns. While airports have kept upgrading facilities, many remain dependent on outdated power grids, centralised energy supply, and legacy IT systems that can be difficult to overhaul. Heathrow, for instance, opened in 1946 and expanded incrementally. Its electrical systems reflect a patchwork of upgrades rather than a fully modernised design, said an aviation expert.Most major hubs and airports of the world have started moving towards 2050 net-zero carbon emission goals (India’s net-zero target is set for 2070). In the coming decades, the demand for electricity at airports will see a steep rise as it powers everything from vehicles to aircraft. The move towards sustainable energy will happen even as terminal buildings and runways handle ever-increasing volumes of passengers and flights. Airports have begun preparing for this and “electrical resilience” has become a critical aspect of operations in recent years.All the 40 airports surveyed in a US study were found to be planning for or completing electrical infrastructure projects aimed at increasing their power resilience. These include removing overhead routes for an airport’s main feeder lines and taking those underground, and upgrading infrastructure to eliminate single points of failure. The latter is exactly the kind of upgrade that would prevent a Heathrow-like crisis.One of the most promising solutions — which began to find takers starting in the early 2000s — is the adoption of microgrids. These are localised grids that can operate independently or in tandem with the main grid, offering a self-sustained power supply. Microgrids can integrate renewable energy sources like solar and wind. Through these, and along with battery storage and backup generators, airports can reduce their reliance on external power sources. As airports move towards an increasingly electrified future, ensuring power reliability is no longer optional. Heathrow’s disruption should not just be another unfortunate event in aviation history — it should be a turning point.","Heathrow's power outage is a warning for the entire airline industry. Mumbai airport runs on 100% renewable energy, 5% comes from on-site solar generation and 95% from hydro and wind energy. Bangalore International Airport Ltd (BIAL) said it uses a highly resilient and redundant power infrastructure for uninterrupted operations.","https://static.toiimg.com/thumb/msid-119361225,imgsize-6416,width-400,resizemode-4/119361225.jpg"
Nagpur riot-hurt dies; CM Devendra Fadnavis says vandals must pay up,https://timesofindia.indiatimes.com/india/nagpur-riot-hurt-dies-cm-devendra-fadnavis-says-vandals-must-pay-up/articleshow/119359389.cms,"Fadnavis hints at

Malegaon link

to

Nagpur riots

, says int'l elements' role being probed

NAGPUR: A 38-year-old welder died Saturday from wounds suffered in Monday night's riots in Nagpur, becoming the first fatality linked to the violence over demands to remove Mughal emperor Aurangzeb's tomb from Chhatrapati Sambhajinagar.Sources said Irfan Shafiq Ahmed Ansari from Bande Garib Nawaz Nagar was caught in the crossfire while heading to Itwari station. His family demanded murder charges against rioters and compensation. CM Devendra Fadnavis promised strict action against rioters, including recovering the cost of property damage from them.Irfan Shafiq Ahmed Ansari, who was injured in the crossfire during the Nagpur riots, was found critically wounded and was taken by senior inspector Sanjay Singh to a hospital. Govt covered medical expenses of Ansari.Two men accused in Ansari's assault have been arrested. CM Devendra Fadnavis promised strict action against rioters and stone-throwers, including recovering the cost of property damage from them. ""We will survey the damages and pay compensation to those whose vehicles or properties were damaged. The money will be disbursed in a week, but we will ensure it's collected from the rioters,"" he said. ""If they fail to pay up, their properties will be seized and sold to recover losses.""Fadnavis reviewed the law-and-order situation in affected areas and suggested a connection between the Nagpur riots and Malegaon, saying authorities were investigating involvement of international elements. He said PM Modi's scheduled visit to Nagpur for Gudi Padwa would proceed as planned.Police arrested alleged riot mastermind Fahim Khan's mentor M Hamid Engineer, president of Minorities Democratic Party, and web portal journalist Mohd Shahzad. Both were held late Friday night for allegedly inciting the riots and charged with sedition.Police sources said Engineer has provided leads regarding the Malegaon link mentioned by Fadnavis. Engineer, a long-time figure in minority politics, had allegedly flooded social media with inflammatory posts before the riots.His online appeal for contributions to ""Mujahideen"" raised speculation about his role in inciting violence in Nagpur. Engineer had been arrested earlier in 2011 for his alleged role in the Mominpura mob violence. Shahzad had circulated a speech by Khan that went viral. Both men were remanded in police custody for three days.A special committee from opposition Congress accused state govt and police of conducting a biased investigation, alleging that groups affiliated with the governing alliance were receiving ""silent support"" to incite violence.The delegation was denied permission Saturday to visit the riot-affected areas and warned of legal action if they defied the order. ""CM says it was a conspiracy. If so, then what was your law-and-order machinery doing? CM must resign, or the governor must dismiss this govt,"" Congress' Manikrao Thakre said.","Irfan Shafiq Ahmed Ansari was caught in the crossfire while heading to Itwari station. CM Devendra Fadnavis promised strict action against rioters, including recovering the cost of property damage from them. PM Modi's scheduled visit to Nagpur for Gudi Padwa will proceed as planned.","https://static.toiimg.com/thumb/msid-119359982,imgsize-1021360,width-400,resizemode-4/119359982.jpg"
