Article Title,Article Link,Article Text,Article Summary,Article Image
"SC uploads video of burnt currency given by police, HC CJ suggests deeper probe; judge Yashwant Varma cries conspiracy",https://timesofindia.indiatimes.com/india/sc-uploads-video-of-burnt-currency-given-by-police-hc-cj-suggests-deeper-probe-judge-yashwant-varma-cries-conspiracy/articleshow/119358397.cms,"NEW DELHI: A video that Delhi Police commissioner Sanjay Arora shared with CJI I Sanjiv Khanna and Delhi HC CJ D K Upadhyay, purportedly revealing burnt cash at Justice Yashwant Varma 's house on March 14, appears to have clinched the case for a deeper probe against the sitting Delhi HC judge, who, despite the graphic evidence, had claimed to be innocent and alleged a frame-up.CJI Khanna on Friday asked Delhi HC CJ to categorically seek Justice Varma's response to three queries: 1) How does he (Justice Varma) account for the presence of money/cash in the room located on his premises; 2) Explain the source of money/cash that was found in the said room; and 3) Who is the person who had removed the burnt money/cash from the room in the morning of March 15, 2025?CJ Upadhyay, in his report to the CJI, said Delhi Police chief Arora had shared video of the alleged fire incident and the discovery of cash in the residence of Justice Varma on March 14 night. He said that on being shown the video and asked about the source of the money and explanation about its presence in his official bungalow, Justice Varma expressed ""some apprehension about conspiracy against him"". The Delhi CJ concluded by saying , "" I am of the prima facie opinion that the entire matter warrants a deeper probe.""The CJI had also asked Delhi HC CJ to ascertain ""details of the official staff of the HC Registry, the personal security officers and the security guards who were posted at the residence of Justice Varma during the last six months. Request letter may be sent to the mobile service provider(s) for providing call record details of the official or other mobile phone number(s) of Justice Yashwant Varma for the last six months"".The CJI had also asked Justice Upadhyay to advise Justice Varma to ""not dispose of his mobile phone(s) or delete or modify any conversation, messages or data from his mobile phone(s)"".In response, Delhi HC CJ wrote: ""The call details record has been received and is being forwarded in a pen drive along with this letter. As regards IPDR, the same shall be furnished to you as soon as it is received from the commissioner of police, Delhi/mobile service provider""Maintaining that he was innocence, Justice Varma wrote: ""I state unequivocally that no cash was ever placed in that storeroom either by me or any of my family members and strongly denounce the suggestion that the alleged cash belonged to us. The very idea or suggestion that this cash was kept or stored by us is totally preposterous. The suggestion that one would store cash in an open, freely accessible and commonly used storeroom near the staff quarters or in an outhouse verges on the incredible and incredulous.""On the video of the cash on his residential premises, Justice Varma said, ""I was totally shocked to see the contents of the video since that depicted something, which was not found on site as I had seen it. It was this that prompted me to observe that this clearly appeared to be a conspiracy to frame and malign me. It also lends credence to my firm belief that the entire incident is part of a sequence of events, which occurred in the recent past, including the unfounded allegations that circulated on social media in Dec 2024.""He added: ""What baffles me is the complete absence of any sacks of allegedly burnt currency that were ever recovered or seized. We categorically assert that neither my daughter, PS nor household staff were shown these so-called sacks of burnt currency,"" he said.","A video that Delhi Police commissioner Sanjay Arora shared with CJI I Sanjiv Khanna and Delhi HC CJ D K Upadhyay, purportedly revealing burnt cash at Justice Yashwant Varma's house on March 14, appears to have clinched the case for a deeper probe. Despite the graphic evidence, Justice Varma claimed to be innocent and alleged a frame-up. The Delhi CJ concluded by saying, "" I am of the prima facie opinion that the entire matter warrants a deeper Probe""","https://static.toiimg.com/thumb/msid-119358635,imgsize-831802,width-400,resizemode-4/119358635.jpg"
'Was leading a team of software engineers': Kolkata techie jumps to death from office building,https://timesofindia.indiatimes.com/city/kolkata/kolkata-techie-jumps-to-death-from-office-bldg-6th-floor/articleshow/119224250.cms,"Key highlights:

Dwaipayan Bhattacharjee, a senior manager at an Indo-American IT firm, tragically died after falling from his office building's 6th-floor refuge area.

Investigations reveal Bhattacharjee was battling depression, and police are examining all angles, including reviewing CCTV footage for further insights.

Bhattacharjee's colleagues noticed his distress on the day of the incident, and his family confirmed he had been under significant stress recently.

KOLKATA: A 50-year-old senior manager employed with an Indo-American multinational IT consulting and outsourcing company, Dwaipayan Bhattacharjee, jumped to death from the 6th-floor refuge area of his office at Candor Techspace in New Town on Wednesday afternoon.A resident of Mudiali in south Kolkata, he is survived by his wife and two children. Investigations revealed that Bhattacharya was battling depression and was under medication. While initial findings indicate suicide, police are investigating all possible angles.According to police sources, Bhattacharya arrived at work as usual and logged into his system. However, colleagues claimed that he appeared distressed and distracted throughout the day. Shortly after lunch, around 3 pm, his bloodied body was found at the parking lot outside the office tower. His family also informed authorities that he was under stress in recent times.""We are reviewing CCTV footage to determine the exact circumstances under which he accessed the refuge area ,"" said a senior officer of Bidhannagar City Police.A 1994-batch (BSc physics) Presidency University alumnus, Bhattacharya was leading a team of software engineers in his organisation. The on-duty security guards were the first to react after hearing a loud thud. They found him lying face down in a pool of blood.Senior office personnel alerted the police, and Bhattacharya was rushed to a nearby private hospital. He was admitted to the Intensive Care Unit but succumbed to multiple injuries . Cops have sent the body for post-mortem and are examining his gadgets.""A case of unnatural death has been registered at Techno City police station,"" the officer added.","Dwaipayan Bhattacharjee, a senior manager at an Indo-American IT firm, tragically died after falling from his office building's 6th-floor refuge area. His colleagues noticed his distress on the day of the incident, and his family confirmed he had been under significant stress recently.","https://static.toiimg.com/thumb/msid-119234732,imgsize-23934,width-400,height-225,resizemode-72/119234732.jpg"
CBI files closure report in actor Sushant Singh Rajput death case,https://timesofindia.indiatimes.com/india/cbi-files-closure-report-in-actor-sushant-singh-rajput-death-case/articleshow/119348385.cms,"NEW DELHI: The Central Bureau of Investigation (CBI) has filed a closure report in the death case of actor Sushant Singh Rajput The actor was found hanging at his Bandra home on June 14, 2020.The CBI on Saturday submitted its findings before a special court in Mumbai which will now decide whether to accept the report or order further probe by the agency, officials told news agency PTI.The Mumbai Police's initial report had indicated that Rajput's death was a case of suicide. Investigators had found no evidence of forced entry, and the preliminary findings suggested that depression could have been a contributing factor. His body was discovered hanging from the ceiling fan, but no suicide note was recovered from the scene.Later, Sushant’s family lodged an FIR in Patna against Rhea Chakraborty and others, alleging abetment to suicide, theft, cheating, and wrongful confinement. This led to a jurisdictional dispute between the Bihar Police and the Mumbai Police, as the latter had initially been handling the investigation.Following the Bihar government’s recommendation, the central government approved a CBI probe into the case. On August 19, 2020, the Supreme Court of India directed the CBI to take over the investigation, granting the central agency full authority to conduct the inquiry.In its conclusive medico-legal opinion to the CBI, forensic specialists at AIIMS had dismissed the claims of ""poisoning and strangling"" made in the case.","Sushant Singh Rajput was found hanging at his Bandra home on June 14, 2020. The Mumbai Police's initial report had indicated that Rajput's death was a case of suicide. His family lodged an FIR in Patna against Rhea Chakraborty and others.","https://static.toiimg.com/thumb/msid-119348368,imgsize-17390,width-400,resizemode-4/119348368.jpg"
"BJP wary of Nitish Kumar's 'erratic behaviour', fears it will give ammo to opposition before Bihar polls",https://timesofindia.indiatimes.com/india/bjp-wary-of-nitish-kumars-erratic-behaviour-fears-it-will-give-ammo-to-opposition-before-bihar-polls/articleshow/119322270.cms,"NEW DELHI: As Bihar chief minister Nitish Kumar continues with his unpredictable and ""erratic"" behaviour, a section of BJP is worried about the repercussions of his ""poor health"", even as the party remains firm on contesting the assembly polls due this year under his leadership.In a fresh controversy, Kumar abruptly got off the stage when the announcement for the national anthem was made after the inauguration of the Sepak Takraw World Cup in Patna on Thursday and began exchanging pleasantries with the participants. Later, when the national anthem was played, he stood smiling and waving at bystanders.Kumar came under heavy opposition fire in both Houses of the state legislature for disrespecting the national anthem. His latest act led to much mirth and has given fodder to opposition parties, RJD and Congress, to exploit in the upcoming state polls, arguing he can't be given another term in view of his health condition.BJP, sources said, is confident of winning another term alongside JDU and LJP, but the party's worry is that Kumar's unexpected behaviour in the public glare has often given openings to opponents.The party, however, believes Kumar continues to be a valuable partner, and the memories of RJD's ""jungle raj"" will blunt any possibility of ""anti-incumbency"". Moreover, Kumar is credited with good governance and raising the bar in terms of performance which, BJP insiders feel, will help the alliance win another term.Of late, Kumar's behaviour has not followed a consistent pattern; there have been days when no mishaps took place and he appeared to be in control, like during his 'Pragati Yatra', even though he was in the public glare for several days. But there have been odd days when Kumar behaved in a manner that his opponents derided him, and his supporters found difficult to justify. ""We hope that Nitish Kumar will overcome his on-off ways,"" a BJP functionary said.On questions raised by opposition parties on Kumar's fitness, BJP spokesperson Sambit Patra said it would not be appropriate for him to comment on any neta's health. ""One can talk about political fitness, and everyone knows who is the most politically unfit leader,"" he said in a swipe at Congress's Rahul Gandhi.","Bihar chief minister Nitish Kumar continues with his unpredictable and ""erratic"" behaviour. A section of BJP is worried about the repercussions of his ""poor health"" The party remains firm on contesting the assembly polls due this year under his leadership.","https://static.toiimg.com/thumb/msid-119323734,imgsize-61526,width-400,resizemode-4/119323734.jpg"
"Judge 'cash at home' case: SC shares video and photos of charred notes at Justice Yashwant Varma's house, makes report of Delhi HC CJ public",https://timesofindia.indiatimes.com/india/supreme-court-shares-video-photos-of-cash-at-justice-yashwant-varmas-house/articleshow/119355290.cms,"Fire incident leads to discovery of cash

Justice Varma raises conspiracy concerns

Supreme Court demands answers

The source of the unaccounted cash.

Identification of the person who removed the burnt cash on the morning of March 15.

Preservation of all mobile data, including call logs and messages.

Three-judge inquiry panel formed

NEW DELHI: In a rare public disclosure, the Supreme Court on late Saturday night uploaded reports, photos, and videos related to allegations of unaccounted cash discovered at the official residence of Justice Yashwant Varma, a sitting judge of the Delhi High Court. The materials, now available on the court’s website, reveal the findings of an internal investigation and Justice Varma’s detailed response denying the allegations.The controversy erupted after a fire at Justice Varma’s official residence on March 14 led to the discovery of large quantities of cash. The Supreme Court’s decision to make these documents public signals the seriousness of the allegations and the judiciary’s commitment to transparency.According to the report by Delhi High Court Chief Justice Manmohan Upadhyay, the fire broke out in a storeroom of Justice Varma’s residence at approximately 11:30 PM on March 14. The fire was reported by Justice Varma’s personal secretary after being informed by household staff, reported Live Law.The next day, Chief Justice Upadhyay, along with the High Court’s Registrar, visited the bungalow and personally inspected the scene. The report mentions that the storeroom was located separately from the main living quarters and had limited access to Justice Varma’s servants, gardeners, and occasionally CPWD staff.The Delhi Police Commissioner shared with Chief Justice Upadhyay images and videos from the scene, which showed sacks of cash—some of it burnt. The Supreme Court has now released these materials publicly, offering an unprecedented look into the case.When shown the photographs of the cash, Justice Varma expressed concerns about a potential conspiracy against him. In his formal response to the Chief Justice of India, he categorically denied any connection to the cash or knowledge of how it arrived in the storeroom.“I unequivocally state that no cash was ever placed in that storeroom by me or any of my family members. The suggestion that this cash belonged to us is preposterous. The storeroom is an open, commonly used area near staff quarters, disconnected from my living spaces,” Justice Varma stated.He also criticized the media for what he described as premature and defamatory reporting. “I only wish that the media had conducted some enquiry before I came to be indicted and defamed in the press,” his response added.Following the initial inquiry, Chief Justice of India Sanjiv Khanna instructed Chief Justice Upadhyay to seek further clarification from Justice Varma on three critical points:Justice Varma has been explicitly asked not to delete any data from his phone.In light of the findings, the Supreme Court has formed a three-member committee to conduct an in-depth in-house inquiry. The panel members are Justice Sheel Nagu (Chief Justice, Punjab & Haryana High Court), Justice GS Sandhawalia (Chief Justice, Himachal Pradesh High Court) and Justice Anu Sivaraman (Judge, Karnataka High Court).Additionally, Justice Varma has been temporarily relieved from judicial duties. The Delhi High Court Chief Justice has been instructed not to assign him any further cases pending the outcome of the inquiry.","The Supreme Court on late Saturday night uploaded reports, photos, and videos related to allegations of unaccounted cash discovered at the official residence of Justice Yashwant Varma. The materials, now available on the court’s website, reveal the findings of an internal investigation. Justice Varma has denied any connection to the cash or knowledge of how it arrived in the storeroom.","https://static.toiimg.com/thumb/msid-119355263,imgsize-454219,width-400,resizemode-4/119355263.jpg"
Murdered Meerut man's mother says 'want to keep granddaughter with us' - 'What if Muskan did something to the child?',https://timesofindia.indiatimes.com/india/murdered-meerut-mans-mother-says-want-to-keep-granddaughter-with-us-what-if-muskan-did-something-to-the-child/articleshow/119349284.cms,"The accused in Meerut murder

NEW DELHI: The mother of Meerut man Saurabh Rajput , who was allegedly murdered by his wife Muskan Rustogi and her lover Sahil Shukla, has made an emotional appeal for justice, demanding the strictest punishment for those responsible. She has urged Prime Minister Narendra Modi and Uttar Pradesh chief minister Yogi Adityanath to intervene and ensure a thorough investigation into the case.Speaking to ANI, Saurabh’s mother expressed her deep anguish and also called for her granddaughter to be brought to them. ""She is our granddaughter; we have the right to see her. If the mother could harm her own husband, what if she did something to the child too? We haven't seen her since the incident, and we want to keep her with us,"" she said.She also questioned how her son’s wife managed to escape after committing such a crime. ""Where did she find the courage to kill her husband and leave so easily? She is roaming freely with her lover. Who is he? Where did she go with him? There must have been some planning behind this. She did not act alone,"" she added.Demanding the death penalty for those involved, she said, ""Those responsible for my son's murder should be hanged. I appeal to Modi ji and Yogi ji for justice. The investigation should be conducted by any agency — crime branch, CBI, or anyone — but I need to know every detail. What happened? What was the reason? Was there a fight between them? I need all the answers.""Saurabh's mother also questioned the events leading up to the murder. ""If my son had been facing such serious problems, he would have told me something. He came home on the night of March 3 but never mentioned anything. If he had been troubled, he would have said something. That girl never used to do any household work, and the neighbors also knew about their issues.""Meanwhile, Saurabh's post-mortem report mentioned that his heart was punctured by deep stab wounds, head was severed from the body, both hands were cut off from the wrist and his legs were bent backwards, suggesting an attempt to fit the body in a drum.Medical experts concluded that Saurabh's death was caused by severe shock and massive blood loss. The post-mortem examination revealed three deep, forceful stab wounds to the heart, suggesting a sustained and brutal attack.","Meerut man Saurabh Rajput was allegedly murdered by his wife Muskan Rustogi and her lover Sahil Shukla. His mother has made an emotional appeal for justice, demanding the strictest punishment for those responsible. She has urged Prime Minister Narendra Modi and Uttar Pradesh chief minister Yogi Adityanath to intervene.","https://static.toiimg.com/thumb/msid-119349262,imgsize-81926,width-400,resizemode-4/119349262.jpg"
"'Told they were husband, wife, stayed in room all day': How 'killer' Meerut wife, her lover tried to evade police",https://timesofindia.indiatimes.com/india/told-they-were-husband-wife-stayed-in-room-all-day-how-killer-meerut-wife-her-lover-tried-to-evade-police/articleshow/119340721.cms,"'Presented themselves as husband and wife'

'Asked driver to bring a cake'

Sahil, Muskan's Holi celebration

Post-mortem reveals chilling details



NEW DELHI: Muskan Rastogi and her lover Sahil Shukla appeared to have planned an elaborate getaway in the wake of their shocking crime. The duo, accused of murdering Muskan’s husband, former Merchant Navy officer Saurabh Rajput , attempted to evade the authorities by fleeing to Himachal Pradesh immediately after the gruesome act. On March 4, Rajput was drugged, stabbed, dismembered, and his remains were concealed within a cement-filled drum in a chilling murder plot.Immediately after the murder, the pair drove away from Meerut and reached Kasol, in Himachal Pradesh, where they checked into a local hotel on March 10. During their six-day stay, they maintained an unusually low profile.According to the hotel operator, the couple presented themselves as husband and wife and remained secluded in their room, rarely venturing out, as reported by PTI. They avoided interactions with the staff, refused routine housekeeping, and left the room only once daily in a private car.According to PTI sources, Muskan's online conversations and audio exchanges with the cab driver, who transported her and her lover to Himachal Pradesh, were widely shared on social media.""One of the videos revealed that Muskan had sent a voice message to the driver via WhatsApp, requesting him to bring a cake,"" the police said.Another video showed Muskan celebrating her birthday with Sahil, feeding him cake. The duo smiling at the camera, their faces smeared with colours after celebrating Holi, with loud music blaring in the background.The calculated silence of Muskan and Sahil did little to disguise their frantic attempts at cover-up. Their actions were designed to create an illusion of normality; at check-out, they casually informed the hotel operator that they were returning from Manali en route to Uttar Pradesh.Also read: Muskan Rastogi, her lover Sahil Shukla played Holi days after murdering Saurabh Rajput Meanwhile, back in Meerut, a complaint from Rajput’s family finally set the wheels of justice in motion. The case gained momentum when Muskan’s father, Pramod Rastogi, compelled his daughter to confess the horrific details of the murder while on a scooter ride to the police station. It emerged that Muskan, under coercion and influence, had participated in the murder alongside Sahil—her accomplice who allegedly manipulated her into committing the unthinkable.The post-mortem of Saurabh Rajput revealed shocking details about his murder. His head was severed, both hands were amputated, and his legs were bent backward, indicating an attempt to fit the body into a drum. The autopsy confirmed he was stabbed three times in the heart, causing severe bleeding and shock. After dismembering his body, it was sealed in a drum filled with cement, preserving it. The body had to be painstakingly retrieved by cutting open the cement-filled drum.Police investigations soon uncovered that the body, dismembered and sealed in a cement drum, had been recovered from a house, leading to the arrest of both Muskan and Sahil on March 18. During questioning, Sahil reportedly confessed that on the night of the murder he had instructed Muskan: “You have to kill Saurabh if we are to start a new life.” He allegedly directed her to sit on her unconscious husband’s chest and, when she hesitated, guided her hand as she stabbed him in the heart three times.Adding another layer to the case, neighbours recalled Sahil’s eerie behaviour; he was often seen wearing kurtas adorned with ‘Mahakal’ inscriptions and was known for his reclusive habits, such as feeding stray cats and keeping his room cloaked in darkness.Muskan’s mother, Kavita, expressed her anguish and regret that her daughter had never confided in her, attributing Muskan’s secrecy to the possibility of being influenced by drugs or other undisclosed factors.","Muskan Rastogi and her lover Sahil Shukla appeared to have planned an elaborate getaway in the wake of their shocking crime. The duo, accused of murdering Muskan’s husband, former Merchant Navy officer Saurabh Rajput, attempted to evade the authorities. On March 4, Rajput was drugged, stabbed, dismembered, and his remains were concealed within a cement-filled drum in a chilling murder plot.","https://static.toiimg.com/thumb/msid-119341535,imgsize-750963,width-400,resizemode-4/119341535.jpg"
